#en_reviews,upvoted,early_access
"One of the most underrated games on steam. This is Super Smash Bros on PC. Megabyte Punch offers you a great SSB experience featuring a good campaign/story mode single-player/coop full of action and treasures, a lot of customization. You may change every single part of your robot. And of course, a great local multiplayer. If you never played SSB before, it is still a great alternative, as most of SSB abilities are available here, and unlike SSB, you're the one who chooses which abilities you're carrying with you. Pros + Great SSB (clone?) + Strong Local Multiplayer + Entertaining Soundtrack + Hidden treasures + Extensive customizable options + Rich colors Cons - Bad controls if you've never played SSB before - Dialogs may be annoying to get rid of them Play it, specially for the local-multiplayer mode.",True,False
"Greetings This is my first review.   At first I was disappointed becasue my named got changed from Sesshomaru to Sesshoomaru. After playing almost two years now I got used to my name and even my friends call me Sess now days.    This game is a fun game to sit down and play during a long day at work or school. You really do feel like you are a Lord ruling over your own villages in a bigger empire picture with all the other Lords and Ladys and helping your fellow players along the way.  In this game is where you can met people all over the world and you can help each other out. You can work together and fight together and its also great way to play with your friends too.    I also like how Stronghold has added more quest to to earn cards and wheel spins. Good job! I think it would be cool if Stronghold have automonks to send out cure disease or even bless of your own parishes. How about away to save you village like the way you save your castle? So all and all I have fun playing and excited about what new upgrades will come out next.   Here is helpful tip, When its say ""steam needs to be online"" which steam is online, well don't threat do I as do.  Right click on the mini steam icon in the task bar and click on stronghold and play. I hope that helps if it dose leave me a thumbs up!   You can come follow me in House 3 in World 3 eng.  The Great Wyrm has spoken, Sess Sesshoomaru",True,False
A fun game to grind.,True,False
"So many hours of relaxing with this game. Listening to podcasts and driving. Super relaxing. And I can stop whenever I want...but usually it's ""ok, just one more delivery"".",True,False
This game is basically a mercenary simulater. 9/10,True,False
Awsome Game! :),True,False
If you're using this regularly to get better aim you should mix this with Kovaak's. This is a great aim trainer overall but mixing it with Kovaak's will give you better results.,True,True
Good for pepe backrounds,True,True
MELHOR JOGO DE TODOS,True,False
Now I can watch hentai without having to open my browser first 10/10,True,False
"How do I even begin to review this masterpiece. Best sniper game on the market for sure and especially best sniper game that takes place in the World War II era. I had really high expectations regarding this game and they broke every single one of them, whatever went wrong in Sniper Elite III like the AI for example has been fixed in SE4. I also like how Stealth is less nuanced and you can go full rambo if you so choose. I really like the overhaul to the CQB takedowns you can pull off and the revamped kill cam is just hilarious to see sometimes. I also love the new added element of environmental kills and added killcams for those kills. Gives the game a whole new dynamic to me. The best thing about this game are the realistic mechanics a real life sniper would come in contact with. Unless you play on Cadet difficulty you can't just point your crosshair at someone's head and expect a instant headshot on him. You really have to take the distance of the shot and the wind in consideration and account for the bullet drop, which is even worse on silenced ammo, and adjust your aim accordingly.  And yes there is the new Kill Hitler DLC, but I honestly don't mind this is the third time they made it. Honestly I can't think of anything more fun to kill Hitler by sniping his jewels. This is a great game, and I've waited a long time for it. For me personally hands down the best game I bought this year. 10/10.",True,False
"I would not say CS GO is the best FPS game nowadays,  but it is classic! Fire in the hole!!!!!!",True,False
It is a very good game and i reccomend it to most people who like  first person shooter,True,False
How to counter pyros: 1- Get good at soldier 2- Get really good at demoman 3- Become a really exeptional scout and never catch fire 4- Get 15k kills with your strange sniper rifle that you've had for years that you mistakingly sold months ago and headshot the pyro with your mlg flicks and finish him off with your smg or another close range headshot to humiliate him for being bad at the game (or simply throw piss at him and use your bushwaka) 5- T R I C K  S T A B 6- Use your ubersaw because somehow you''re always guaranteed a crit with that thing,True,False
"There have been major changes within the 10th b-day of Team Fortress 2, Though the debuffs on Heavy I VERY much like and will make less of those heavy spammers, Pyro has new weps and older modifcations has been added back. The community taunts are great and hope this will revive our ""tf2 is dead/dying"" players back",True,False
I cannot to make comment . Just live it,True,False
"Creativerse is an open world multiplayer crafting/building game. Along the same aspects of Minecraft but with a lot of extras. Obviously with the success of Minecraft (Mojang 2011) there have been tons of games that are around the same aspect of being able to build whatever your imagination can think of. Well Creativerse lets you do that. Now there's two different versions of the game currently. Obviously there's the Free to Play version but ther's also the Creativerse - Pro version ($19.99) which gives you the features to create multiple worlds and be able to customize them with additional advanced options, a glider to be able to fly through the skys as you're looking for somewhere to build, a flashlight to be able to see in front of you in dark areas, additional backpack slots (+20), +100% more stamina and you're able to claim 2 stakes for free in every world. Even without paying for the Pro version there's tons of stuff you can do in Creativerse. You can travel through a gigantic world that has wide a variety of enviroments each with creatures. Underground is just as immersive but it's a lot more dangerous than the overworld, so if you're looking for a survival challenge underground is the place to be. There's day/night cycles, weather cycles, temperature and tons of other things that make this game beyond amazing. As for building there's a blueprint system that you can follow and build amazing structures step by step as it shows you how or you can just go off on your own and create whatever your mind feels like. There's over 400 pieces of material to build with, wireless machines and complex interactions such as creature spawning, block manipulation, checkpoints and much more. If you're the type that likes to play sandbox games alone you can build your own private world and build to your hearts content. But even with a private world you have the ability to invite your friends so they can see your creations. Meeting new people and seeing amazing designs is very simple in Creativerse, you have the ability to browse through live player worlds. When you do that you have the ability to visit the world or stake your claim and make your own home in that world. Get out there, get inspired and build alongside this wonderful community that is Creativerse.",True,False
BOM D+!!!!!!!!!!!!!!!!!!!!! COMPREM!!!!!!!!!!!!!!!,True,False
be sure to watch the danganronpa 3 anime after this to finish the hope's peak arc other than some lag issues and chapter 3 being rushed this is a masterpiece,True,False
"I love this game, but there is too much pay to win players. If you're good then you will win but this is really annoying thing. Anyway if you like basketball, you should play this game! :)",True,False
I just stayed alive for 17.2 seconds on the first level and I feel like a f%*#ing superhero.,True,False
"It's a visual Novel with an Intresting and unique gameplay mechanic, and it's allot of fun. It's definitely worth the price",True,False
"Okay so first of all. Team killing is a big problem which isn't really that hard to fix. ""but there is one?"" - Random dude. I hear you say, and yes infact there is one but giving someone an hour cooldown when they've killed three players for no reason. And as far as me and my friend has tried it doesnt give you: one hour. two hour and so on. It gives you a one hour cooldown then you wait it and it will give you another one hour cooldown. But the game has alot to give and is alot of fun when you meet nice players and I love it. 8/10",True,False
"Don't listen the the reviews, OSRS is trash. 85% of its player base is made up of bots. Its not a good game, if you wanted to play OSRS it'd be better to make a time machine and go back to 2007. Elitist idiot OSRS players will tell you different. Don't listen to them. They're just upset that OSRS is coming to steam and not Runelite ( the overpowered client they use which plays the game for them and hold their hands the way that mommy never would).",True,False
"F.E.A.R. 2: Project Origin | October 18, 2020 | [★★] In my opinion, It is a very clean made game. Throughout my play-through, I've never encountered a thing that it shouldn't be there. I think being super linear helps a lot in that case. Gameplay is pretty much shoot and kill then enter the next level - enemy spawn there and do the same. The AI's movement felt generic making them easy to read. I've only died 2 times (Excluding those failed grenade attempt) throughout the campaign in Normal mode. I can't say otherwise on other difficulty but it was an easy course game. The story doesn't really give a lot until it finally became clear by reading through massive hundred journals scattered around the game. It sometimes wasn't fun reading those but at least it picked up half the game that it makes me intrigue and engage with what's happening. I've never actually played the first one and this one make me want to check it to see what I've been missing. Overall experience is a big thing for me and sadly this just gave me a flat one. I knew horror is one of the main theme of this game, but I've never felt that. Jumpscape doesn't really bothers me specially with no consequences unlike Dead Space where those who freak you, can actually kill you and that makes it more terrifying. I just wish this game have that.",True,False
alternatywa na Teamfight Tactics jest ok / nadal swietna spaniala oguem,True,True
"The devs just need to focus more on optimizing the game, overall it is a masterpiece...",True,True
"A super fun game where you can download mods in game with the click of a button, and pretty much do whatever you want! Super cool physics and its fun just doing random things! 11/10 -IGN Game of Dah YearZ",True,False
"This game is fun, but overpriced It also can get repetitive quickly. Its worth to pick up for 5 bucks but i wouldn't but it on its current 16,99.",True,False
"Harder than Dark Souls Edit: They added a way to make the game easier.  Also, why did I even write that? I've never played Dark Souls.",True,False
"Garfield as a playable character would be amazing. He would have a hairball gun with a big ♥♥♥♥ on the side, and when you press shot a giant mech cat would appear at the guns end and it will open its mouth and gag and a hairball would come out, instantly K.O'ing the enemy.......",True,False
"Fun if you're one of the lucky ones. Also kinda fun if you have a big brain and don't need the easy way that is Supreme Cards. Came for Final Fantasy, stayed for the game and generous (at least I think it is) events.",True,False
Such a wonderful experience <3 Thanks,True,False
A nice game created by GABEN.RESPECT!!!,True,False
"Some games are very good, but the online mode needs improvement I really like Final Fantasy and hope game developers can improve some issues",True,False
Its a very nice game and quite frankly I enjoyed this 2D side-scrolling game and taking the zombies down with fire and blade as a start then  you get to unlock many other weapons like the shotgun and the butcher's axe it has amazing simple graphics and decent sounds.,True,False
One of the best Games I ever played!,True,False
Pretty good game from my childhood. defintly recommended to all,True,False
I would recomend the game to anyone who would like a challange. it is un but hard to get started on.  One you get the hang of it it's the most amazing game ever. On the official servers there is a slight problem with cheaters other then that there is noting bad. 9/10 would recomend,True,False
"-Unique gameplay mechanics which makes it standout from usual traits of this genre of games. -Great environmental,graphical (effects, textures and model) design. -One of the most if not the most gore-filled, violent and revolting game of this current gen. -Free for existing owners. -Superior art direction conveying the gore and horror petrified halls of hell. -Tons of unlockable content,modes and different endings. -Improving on almost all aspects of its predecessor. -fairly priced for the content it has to offer -Gameplay tends to become repetitive fairly quick. -Transparent storyline. -Unevenly placed checkpoints. -Choppy voice-acting. -Limited interaction with the vast environment. -Fickle stealth mechanics which causes too many sudden death encounter progressing throughout the game.   The story itself follows a lost soul trapped in the depth of the horrifying hellscapes without any memories of his former life. Slowly its revealed of what's the protagonist's backstory, he was a ruler of an ancient land who made a Faustian bargain with the Red Goddess. In-story, he is referred to as both Nimrod by the Goddess and other trapped souls some of whom still have their memories, blaming the protagonist for them being destined to hell because of his rather negative acts he performed while alive. As the protagonist wanders through the wastelands of hell, he discovers a possibility of escaping through the aid and guidance of the Red Goddess. Eventually, he travels to the Red Goddess' lair to learn how he can be set free from the torments of hell. The game itself is a mix-match of Puzzle, Exploration and Stealth. The first person perspective is highlighted mostly during the exploration. The environments are highly detailed with hints of finding notes and other important things that leads you to a better understanding of what's going on. The wormhole of gore gets worse with every step people mutilated beyond recognition, pools of blood etc. Uses of tools provided such as torches opens new paths but attracts more enemies. Stealth here is the most highlighted mechanic which gets u through most of the later stages. Camouflage by hiding in mounds of corpses is crucial to the game's progression. Puzzles in particular is pretty easy mainly consisting of finding and delivering items. Certain types of enemies can also be avoided in a puzzle like manner with the help of the aid of notes and some others by yourself. Overall sometimes it may come off as all shock, and no substance. The take on hell is amazing, but the underlying gameplay can become frustrating.  You will begin your journey as a tormented soul within the depths of hell, without any memories about your past. The special ability to control people on your path, and even possess simple minded demons, gives you the necessary measures to survive in the extreme conditions you are in. By exploring the hostile environment and interacting with other weary souls of the hellscape, the protagonist will soon understand that there is only one way to escape from Hell, and it will require meeting the mystical Red Goddess. By summing up notes the storyline and dialogues are revealed. The narration slowly hints at some lore with the eventual progression and slowly reveals the ""Big Picture"". Definitely the best aspect it shines the most. Brilliant depiction of hell and its miseries with the help of Unreal Engine 4 delivers on a solid experience. Great sound design and music, even though it isn't much noticeable some dialogues don't sync up which makes the voice acting feel a bit lacklustre. The game itself is very demanding maybe because of the absence of optimization but didn't notice anything huge while running on a system based on (gtx 1050 ti,16gb ram) frame rates are pretty solid too. Nothing sevre got bought to my attention. Safe to say no major bugs in this incarnation. Agony is a game not made keeping the mainstream gamers in mind so it's obviously not everyone's cup of tea. But for those willing to experience it the game ensures a solid horror experience. Overall a reasonably priced horror experience.",True,False
"I love this game, please add a new map",True,False
"Well as it CURRENTLY stands, this game is just great. Yea its not perfect and unfortunately has a lot of awesome content locked behind a bunch of cash, but man even then what you get even in the base game is great. This game is for sure at its best with everything available though, but besides all that just know this game is just great for Jurassic Park/World fans. It could use much more dinosaur interactions and more unique animations/dinosaur personalities. But even without this its still solid. Game Score: 9/10",True,False
Best free game I ever played hands down ;) LOTS OF CONTENT!!,True,False
"i would have to say its a good game. co-op is bit dodgy, but overall its good",True,False
>le me is being a bold cross eyed ♥♥♥♥ >throwing boots in random room >die to randomness >die being stupid >die >win >still cross eyed bold ♥♥♥♥ 11/10,True,True
Loved this game. Never got a chance to play the Lost Chapters expansion so getting to play it this time around with better graphics really was an experience. My only complaint is that the combat is a little dated and clunky and I had quite a few minor UI bugs that were exceptionally annoying. All in all though I'm definitely glad I picked this game up. It is a great game all together with pretty good replay value and lots of little heres and theres to keep you interested. I'd say give it a try whether you've played it before or not.,True,False
Great game.,True,False
Anime. Souls-like. Tiddy. Whats not to love. That being said... It has nothing on Dark Souls,True,False
this game's ending really made me look into the abyss that i call life and messed with me for a long time after i put it down,True,False
Left me very surprised at how good the story gets.,True,False
best bioshock game,True,False
never played but there are doggos  11/10,True,False
Great graphics,True,False
Really Good Game But Its Kinda Getting Old,True,False
"I've played all Tomb Raiders in the serie, and I can say........THIS IS BEST OF THE FU**ING SERIE!!!!! Amazing landscapes! Amazing weapons! (Not too much, but you can upgrade it, if you want) Amazing skills! INCREDIBLE STORY! Nice NPC's! The only negative of the Tomb Raider.........the multiplayer.......♥♥♥♥, it's so ♥♥♥♥ :( I recommend this game :) (And a big thanks for my friend, Justice Warrior who bought that game for my Birthday! That was an awesome game bro :D )",True,False
"The game is fun to play for the 30 minutes that i have played alone. I do get bored of single player very quick so i'm really waiting for a co-op mode so i can explore the game with my friend. It doesnt have to add many new features yet to multiplayer, just so me and my friend can play on the same world and explore together.",True,True
I have followed this game for a good amount and i really enjoyed the game. At first the game's quality make it look bad however it is fantastic game play.,True,True
<3  Need more boss and maps :),True,False
not fun when idiot friends,True,False
"A fun ""popcorn"" kind of Live Service game. Great gunplay and weapon variety. Missions are good for both busy people as well as for long gaming sessions LOTS of lore and story for enthusiats to dig into.",True,False
1.0 Update. Still amazing. The new maps are big and full of spots. I still say this one is easier to pick up and just rip with over Session. Session has it's place and is also great but SXL allows for a less frustrating learning curve. The included mod maps were some of my fave but I do recommend the Dew tour map by Theo also it's fun. Glad I picked this up early and very happy with the full release just wish there was a skate with a friend option even a game of skate or something. Thanks for reading!,True,True
"The Gameplay, the narrator, and the music only perfect...",True,False
The Game is Really Funny and i really like it. Although the controls were hard but i got used to them.This is one of the best Simulators ever made.Its a lot time-killing and a great Indie Game! You should check the game out!,True,False
"This game is more than just a sexual Visual Novel, don't just come here expecting to get hard or something. This is actual storytelling and a very deep take on strokes of fate. I myself created deep emotional connections to some characters and really felt this story because it doesn't seem fake and in fact very real. This is truly a masterpiece and you should definitely give this game a try, not only for it's sexual appearances.",True,False
"This game is just freakin' awesome. Tight controls, sensible weapons, kick-@$$ soundtrack, and tons of variety for each playthrough has me already sold for the first 4 hours I've played this game. Memories of Bastion and Transistor keep coming back every minute. My rating won't change no matter what happens next, cuz I already got my money's worth. ^_^ Kudos, Supergiant. This is yet another masterpiece.",True,True
"First time when i saw the size of this game i though really only 1 gigabyte? and 30$ worth but after 10 hours of gameplay i know that ""Size Doesnt Matter Guys"". Its best coop game that i ever played.... Wreckfest is pretty nice too if you like to smash someone into the tree:D Alot of Russian Trucks which looks amazing. Realistic physics and damage. With friends you will enjoy this game thats for sure. I can fully recommend it to buy just enjoy it !",True,False
Top,True,False
No HAX No Life,True,False
Ok i may sound like im ranting here the game is good and stuff but the new updates really ruined it the leveling system is crap now i much rather the old one and the ability to use flyers has been so limited and everyone just wants massive titans and their not even that enjoyable wht the game really needs to do is bring back the old concept of it that was actually enjoyable,True,True
"It's a nice game, I love the realistic feeling of being chased and know that the one who is chasing you is a person too so it makes it more scary. It's funny to play it with friends and it makes it better so try it with them now that the game is on sale.  A good game. 10/10.",True,False
"1 of the most dark, unique and beautiful games i've played so far.",True,False
Its DS3,True,False
"good game, but too ez",True,False
"It's pretty hard, but well worth your money and time. Great game",True,False
Truly amazing storyline,True,False
"i can say its a really nice game but you can get ragressive really fast, dont be mad just chill and get concentraded",True,False
Basically the game is really fun if you play it with your friends. Best time to spend some time together having fun during corona.,True,False
Just a great ♥♥♥♥♥ game. Got nothing else to say about it .,True,False
"Awesome game. Stopped playing after awhile because I reached the point where there is almost nothing to do. Then they updated and I had to start over again. Did that and reached the same point where there isn't much else left to do. Now I am waiting for the next update to maybe start over again and see what else they might introduce. No doubt that this game is worth it. How much is it worth it? I have an exam in couple of days and yet I still constantly open the game, even though my colony is at about cycle 850 and there isn't really anything that can kill my colony. No doubt that this game is on the path to being amazing, now it is only awesome.",True,True
Where's the ♥♥♥♥♥♥♥ multiplayer?,True,False
the best of the best,True,True
"Good game! This game has alot of potential and is just getting better and better. Its an EA game so expect bugs, but it is nowhere near unplayable. And the Devs is active and updating the game almost everyday, fixing bugs and adding new items into the game.",True,True
"Great graphics and interface. I used to play Roller Coaster Tycoon 3 so much. This game tops it times 1,000. 10/10 Would vomit again.",True,False
"""The saddest thing about betrayal is that it never comes from your enemies"" - Some 14 year old on instagram.",True,False
This video highlightes the problems with the game.Fix the problems highlighted in this video and I would be the happiest man alive.,True,False
Now i'm using it almost always when my PC is on.,True,False
R6 is really amazing and fun to play. You need to learn the ropes to double the fun and you gotta find the operator suits you. A trapper? A roamer? Maybe a sneaky one? Or you just like getting your machine gun and destroying everything you see (not really works). You will love it! Just don't give up when you first try the game. You will learn much from pro videos too. Have fun!,True,False
"Just buy PUBG Nevermind, H1Z1 is free now... why not have both. But still...just buy PUBG",True,False
