#en_reviews,upvoted,early_access
"Honestly a great RPG. It has a lot of replay value and all the hours you'll play will feel great as the story, humour, design and music are all amazing. big recommend",True,False
"One of the Best Multiplayer game , you need to do some strategies to win not like other game cs go etc , every operator have unique gadget , i recommend this game it's not that expensive , of course if you don't want to grind renown buy little bit expensiver version of the game , but i prefer to grind and don't have every operator at the start , cause you get to know how to play with every operator 9/10",True,False
Give me an achievement for buying your game bundle :3 Achievement Request Name: horep Description: Do yuo kno da wae? Picture:,True,False
One of the best game i ahve ever played. Create your alternative history of the world :),True,False
needs improvement in anti cheat engine,True,False
Mini Ninjas 2 when?,True,False
"Metro Exodus the third game in the Metro series is simply one of the most enjoyable game I've ever played, it has a very impressive graphics and gameplay upgrade from the last two games.",True,False
i love persona 5 and this game too💛💛💛💛 and I'd love if persona 5 royal coming to PC💖,True,False
What can i say?  -Awesome gameplay -Awesome skins and customs -Awesome cars -Awesome effects -Awesome music Very easy to play and very fun! What are you waiting for? Play it!  10/10,True,False
best game ever and has tournaments  i hope this game wins the nominate award because its has updates,True,False
"Game is beautiful, Graphics are breathtaking, Brilliant Story, Amazing Gunplay, Immersive Environment / Atmosphere  10/10. Worth every cent paid for this game!",True,False
"Bot Colony is an ambitious title, aiming to provide a non-scripted story by allowing you to freely converse with robots. If you enjoyed literary works like 'Do Androids Dream of Electric Sheep', Isaac Asimov's Robot series, movies like 'Space Oddysey 2001'(not one of my favorites though) or Anime like 'Ghost in the Shell' and 'Psycho-Pass', you'll find a similar setting here.  An important remark is that most of the gameplay is text (or speech) conversations, which at times can be both agitating and humorous, and that might not appeal to everyone.  Currently, the game is made of 2 episodes: Intruder and Arrival.   You have 2 objectives. The first one is erasing evidence of a thief breaking into the house, by commanding a robot (Jimmy). The other one is an investigation mission, which you can do at the same time, in which you question Jimmy about what happened at the house in the last 48 hrs. Jimmy will be saying some of his remarks/facts while moving around the house, which can be used as hints to what to ask. Although it might be a struggle at first, once you get used to commanding Jimmy (i recommend reading through  ). This is the first ""real mission"". it consists of multiple objectives that you'll discover while playing, talking with the receptionist, finding your luggage, , getting a ride to your next location. A memorable moment was the talk with Charlie, a cleaner bot who'll help you with getting your ride.     I enjoyed my playtime with BotColony and I'll be waiting for any further updates. If you have any interest on how the robots operate and your interaction with them, I'm sure you'll also enjoy it. While if you're only focused on 'the result' or why the robot isn't doing what you 'clearly' are telling it, you might have a rough ride. Keep also in mind that the game is an early access title, and not everything is polished yet. I played mostly through typing, Voice recognition is pretty decent with the new Microsoft API, but i find it more convenient to type. That said, voice recognition is not made by the developers and is one of the best available on the market. Also the devs like to hear community feedback, so feel free to drop your thoughts on the forums.",True,True
I . . . don't even have words for this :) Gameplay:,True,False
"Everything you heard about this game is true, It is THAT good.",True,False
Great storyline and really fun gameplay. It really is an emotional rollercoaster throughtout the game and the graphics are absolutely stunning. Only complaint is that theres not enough gameplay! 9/10,True,False
"Okay, great game, good optimisation, but not alot updates, that's sad. Just a bug that i found, some players, will just have randoms crashs, may be borring, but i think that's due to the config.",True,True
a very interesting hat centric game that i paid before it was release as FREE TO PLAY...,True,False
Probably The Only Sims DLC Worth The Price... !,True,False
Tally Ho Chaps ! Chocks Away ! 10/10 would fire bomb Dresden again (legitimate war target) Thank you Bomber Harris Cue Dam Busters theme Salute the Queen !,True,False
It cool,True,False
"If you're like me and you like a tug-o-war like game just like the mods/maps in WC3 and Starcraft2 then you'll find this game right up your alley. PROS: Beautiful looking game Superb soundtrack nice progression (you don't get overwhelmed with stuff and you're gradually given access to every aspect of the game) CONS:  Campaign way too easy (I beat it in 2.7 hours) Short campaign Can win by spamming the same unit over and over and upgrading it. But would still recommend it, thoroughly enjoyed it. As short as it was.",True,False
Awesome game moba style on a 2d platform lots of fun go and buy it !,True,False
"This game gave me aids, also my parents hate me for leaving a hole in the floor the size of my ass.",True,False
One of the best that Scott has pulled out of his sleeve. I have made a challenge that got me at 4000 points on a high score. its not much but its my best,True,False
The best hat wearing simulator hands down!,True,False
Game is really fun everyone should try it,True,True
"*Red vents*  *Blue calls emergency meeting*  Blue:""Red is the impostor, I saw them vent!"" Red: ""No, you didn't see me vent!"" Blue: ""I 100% did!"" Red: ""You're lying! I only vented when no one else was around!"" *Blue was ejected. Blue was not an impostor. 1 Impostor remains.*",True,False
This game is amazing!,True,False
"This game is infuriating but also it relies on skill, so it's very rewarding to see yourself actually progress",True,False
Its fun. Thats it. All I have to say. Its fun.,True,False
"I've been playing videogames for almost 15 years, this is the best one I've ever played.",True,False
This game is one of the best FPS of 2012 2013 2014 2015 and its  good optimized,True,False
its aight,True,True
Didn't reach the end game yet due to the online servers being down. And i don't want to start over from scratch on a new character. But so far the game is extremely fun for me. I enjoy the combat and skills. And its possible to make so many builds with the classless progression. So far only 3 acts are available. But from what i've seen about the end game. That alone will keep you entertained for quite a while.,True,False
Nice game,True,True
good game to play with friends,True,False
Bought on a sale graphics can be a yikes at times and the stealth mission is terrible otherwise the game is interesting and fun,True,False
"pretty much the old game with new graphics, is a lot of fun though",True,True
The Best Game Ever,True,True
Fun game. Brings back memories.,True,False
I bought this game because i want to see Ukraine in this game in the future.,True,False
A very good game. Suprisingly stable and well made for being in pre-alpha. Strongly Recommend,True,True
"Awesome arcade action that will leave you asking, WTF?  There are so many ""nuances"", ie bombs that throw the baddies back to the center, ultra speeding up, and slowing down upon certain death, there is no discounting this PAC MAN is the $hit.  Only problem I have is figuring out why I am still alive?  Sweet thumb destruction...",True,False
Time Travel Mechanic the best of any game. Makes you feel like you are fighting in the time war!,True,False
"After the long time spent hoping for a game that involved smashing Zombies and a sense of humour this game satiated that desire.  The improvements over the Dead Island series in terms of fluidity of movement and combat are just incredible.  I wasn't expecting this game to become a great hit, I was expecting moderate success.  This game showed me up and the expansion was well worth it.",True,False
"Purity without a touch of vulgarity and platitude. Hatred without restrictions of common sense. Love without saccharine. A few distinct personalities, caught in the circumstances or making their own mistakes. Which tragedies will they have to face? How will they overcome or succumb? This story has its unique charm and style. Outstanding visuals and fitting music, blending in with the story. The characters are well-written and alive. The text on its own has a great language. This story is filled with beautiful sayings and events. It has quite a share of surprises and sudden moments which will catch you off guard. It's a long game and I'd prefer the last chapter to be shorter. After the promise of the final closure, I was waiting far too long for it to actually happen. Some music tracks are way too repetitive, especially the happy ones. And even though I really like the way how it's written, the amount of ""......"" is sometimes too annoying. In the end I liked this game, I liked this story. And I really liked some of the characters who felt like good acquaintances of mine in the end.  I picked up this game because of it being constantly called ""the best visual novel on Steam"". I finished it looking at all the entangled threads being tied together in a single picture. How different the stories told here are and how well they all attach together.",True,False
An excellent fun and fast paced game that really gets the adrenaline going. Brings back fond memories of road rash with a new and improved style. Definitely worth buying,True,True
"Old but Gold, on of the best story ever, i love this game",True,False
"This is an amazing game,theres tons of stuff that you can do!I can play this game all day and the fun never ends!With hundreds (maby thousands) of addons that the community makes,theres no way anyone can get tired of this game!",True,False
"I played the game now for a long time, and still enjoy it! If you start playing it, you will never get enough.",True,False
10 rips of 10 fu****g tears! DOOM better than ever! Go and play NOW!,True,False
This game is hilarious!,True,False
"Everything blows up, even you.",True,False
Cringe Operators. But game is good.,True,False
"The game allows a stylistic and aggressive approach to combat, in a way you would not experience in dark souls.  Once the mechanics are mastered, it is incredibly satisfying to just replay the game.",True,False
"Great story, First single player game I've been able to get into since Witcher 3, controls are little bit clunky to get used to at first but after a few hours you get used to them. There are countless bugs which stopped me progressing in the story, which I hope they fix soon for future players! I'd recommend maybe waiting for bugs to be fixed or a sale!",True,False
"Wow, just like I expected I just really love RhinoGearz Visual Novels. The writing, story telling and just in general how he likes to form romance stories and relationships just really fits with my own personal likings. You play a young guy entering a magic academy and finding the love of your life in it. The relationship development is really nice and I also really enjoyed the overall story apart from the romance itself. Considering that you also get around 4 hours of story and that it is only 2 euro, I will never understand why his games dont take off more. For this price you wont find anything better on steam when it comes to romance VNs and just overall positive story telling.  If you are looking for a positive and very relaxing read then highly recommended. There is no r18 content though so if you are looking for that you might want to look elsewhere. If you care about story though and not just visuals then its really great. Apart from that the art itself is also pretty good and really if you consider the price you cant expect anything more from this VN. 9/10 Check out my Curator Page:",True,False
5/5 ★★★★★ rating - SO beautiful Illustrations from this artist.  - Puzzles can be played in various difficulties.  - For achievement hunters: Each Puzzle gives you 1 achievement.,True,False
Why are we still here... Just to suffer?,True,False
"Werry nice game and remembering old good stronghold times. :) But here need to long wait when all building, researching and moving army, scouts... :( But good game! :) I hate just werry boring waiting here! :( With that waitings no more I wanna to play this game. Maybe i quit it faster than I thinked... :(",True,False
Go! Go! Jewish! ~My First Trip to Israel~,True,False
hard game but still op love this game,True,False
Imagine being a RS3 player when OSRS exists.,True,False
You King You Win.,True,False
this is the best game so far,True,False
Just played this for the first time and oh my god it does not disappoint.  story is superb.  game is brilliant.  controls a little clunky however.   absolute 9.9/10 though,True,False
Fun game but only really fun with a team mate or friend thats just how I played it with my friend and when he didnt play with me I ad no interest,True,False
fun time managment game. but seriously though was it necessary to put 5 of this title out? ..lol,True,False
Best game ever made lots of fun and heartstopping moments,True,False
"The thought process of this game >This game is fun >I want to play competitive >I'm in silver >Thats cool, I can get better >Oh im nova now! >Im Mg now >This isnt as fun >Dmg >This isnt fun >Le >Why am I playing >Supreme >I cant stop >Global >End my suffering >Esea >Why >Esea Tournaments >Why >Competitions >Stop >Majors >END ME",True,False
Nice background game for passing time.,True,False
☼ Graphics ☼ ☐ Bad ☐ Alright ☐ Good ☑ Beautiful ☐ Fantastic ♬ Music ♬ ☐ Bad ☐ Alright ☐ Good ☑ Beautiful ☐ Fantastic ☠ Difficulty ☠ ☑ Easy ☐ Average ☐ Easy to learn / Hard to master ☐ Hard ☐ Unfair § Bugs § ☐ Bugs destroy the game ☐ Lots of bugs ☐ Few Bugs ☐ You can use them for speedrun ☑ Nothing encountered ☯ Story ☯ ☐ There is none ☐ Bad ☑ Alright ☐ Good ☐ Fantastic ⚔ Gameplay ⚔ ☐ Frustrating ☐ Sleepy ☐ Boring ☑ Fun ☐ Challenging ۞ Game time / Length ۞ ☐ Really short (0 - 3 hours) ☐ Short (4 - 8 hours) ☑ Few hours (10 - 20 hours) [if you focus on the main story] ☑ Long (40-60 hours) [if you complete everything] ☐ Very Long (61-100 hours) ☐ Extremely Long (101+ hours) $ Price / Quality $ ☑ Full price ☐ Wait for Sale ☐ Don't buy ☐ Refund it if you can,True,False
hey hey hey do not ruen my games,True,False
it's crazy lol,True,False
"É um jogo muito bom, pra mim é focado mais em construção das navis, tanks e edificaçoes. A unica coisa que achei ruim é q nao tem coop, podiam criar uma campanha coop onde cada player criava sua navi. It is a very good game, for me it is focused more on the construction of navis, tanks and buildings. The only thing I found bad is that there is no coop, they could create a coop campaign where each player created their own",True,True
I recommend this.  :),True,False
top qame is real,True,False
The Best Sandbox game have I ever played! :D,True,False
"Great Game, Good Gameplay, A Few Glitches Here And There, But Overall A Wonderful Game",True,False
Haven't play this game for an hour and already seeing a  Really recommend it!!! 17/10,True,False
I love this game and there isn't much else to say!!!,True,False
me very trained soldier now me ready war yes plez spetsnaz me want join y'oure army plez,True,False
Shoot some guardians... Yes? Its kill or be killed,True,False
"Town always stupid, I'M THE F****** SHERIFF!",True,False
this game is $$$$$$$,True,True
"Where to start with this game... From perfect soundtrack to interesting ""choice matter"" situations, the game brings a phenominal story which has a great twist, characters which you can easily get attached to and actually feel something for them and finally my favourite, really memorable gameplay which will make you think of the game for quite a bit. The game brings really unique graphics style which is eye-pleasing. There is a lot of things to pick on this game and it's definently worth checking out if you're in deep story games like I'm.",True,False
"pretty boring at times, but it's actually pretty fun!",True,False
"I played this game with a friend and honestly, its a blast! Being infected is really fun as well as being non-infected. There is usually great teamwork between players and people are usually pretty chill (in my experience). There are skins that you can obtain for free which look nice. If you want to win, it is necessary to use good teamwork and this is what I like about the game. Lastly, I just love the animation where you transform into your 'beast form', its really cool xP There are some graphical errors I have found.  ex. If you go to the steam overlay and back into the game, your mouse cursor does not disappear and is just on the screen when you are in the first person perspective playing the game.",True,False
*walks into cave* *uses lighter* *sees Nakid Cannibal* *screams* 11/10 will sit on the toilet for 8 hours again.,True,True
I really like the game,True,False
well if you already know what taimanin saga is no need to warn  if not well be prepared to sink in lust of body suit girl with big milkers ... i'm neutral for this game i dont think its good or bad since its free  just try it and get u'r own opinion  ahh and obviously its a 18+ game trust me kids its not smth u wanna discover soon,True,False
awesome lovely game i recomended.....,True,False
I guess it's okay.,True,False
Really Good Game,True,False
Nice shooter game.,True,False
"Not bad, cool missions and new concepts. Missing something normal civ games have but a decent game worth a couple of play throughs",True,False
awesome game. awesome soundtrack. pog game,True,False
"I'll start by saying I generally don't play hidden object games, the sheer number of them in the market and the fact that so many of them seem to look the same always made me feel like I wouldn't enjoy them.  I was convinced to play this one, though, and I'll admit that I was pleasantly surprised.  None of the puzzles or challenges were too difficult, but even so, there was enough variety that it kept me entertained through to the end (though I did miss the 4 hour time limit for the achievement by about 15 minutes, which meant I had to play through a second time). The only issue I had was during nearly every puzzle, I found myself backing out of them by clicking too close to the bottom of the screen for one reason or another, which did get annoying after a while.  Even after playing the game for hours I didn't seem to be getting any better when it came to this, maybe something like a back arrow somewhere on the screen as an alternative to clicking on the bottom portion to backtrack could help with that.  This is a pretty small complaint though, and most likely something that most people don't have any problems with.",True,False
"Finished the game,  if you're a Korra fan  if you're not. + Combat is fun it's your basic 'Beat'em Up' + Concepts are interesting & lets you try different things than just montonous combat + Lots of secrets to find if you're into that kind of thing + Skill shop so fighting is completely repetitive + Story is interesting enough to intice the Korra fans to keep playing + Cutscenes are cool and fully animated + Pro.Bending. - There's only like a total of 10 models in this game - Little to nill replayability - Combat is a little choppy at times (not exactly fluid & smooth) - Can't fluently change from one bending to another unless in avatar state It's worth the 15 bucks if you like the Legend of Korra series & you've followed up for the last 2 seasons. So the combat is fun & simplistic, you just beat people to a pulp and move to the next segment. They make it feel really good to counter and throw back punches. Naga running segments is essentially like a runner-mode where you slip and slide through obstacles to get to the next segment, and though it's fun it feels a bit contrived. However, the enemies get stale after awhile there's like 10 models and 3 different palette swaps for each one. However, I do keep in mind that kind of budget the developers were probably working with and can empathize the constriction on the lack of diverse enemies/help from an AI. For a license game The Legend of Korra does alright to stand on its own considering the game is only 15 bucks, but most likely confusing to those who haven't seen the show. *****WARNING: SPOILERS/SECRET CODES BEYOND THIS POINT****** In case you do buy the game I've got some goodies: (note I'm using generic commands since everyone's layout is different)",True,False
7.23 TOTALLY BALANCES THE GAME 20/10 would play <3,True,False
"This game is superb, IF you can pick it up on sale with all the episodes. No doubt the gameplay is really polished and refined, but for most people, you're going to need all of the expansions to have fun for more than 10 hours. However, the design is fantastic and there are numerous ways that you can creatively dispatch targets. Definitely recommended.",True,False
One of my absolute favorite games on Steam.. it's cheap and has an amazingly simple yet brilliant concept that is executed perfectly for the games price.. a must have for the music enthusiast who likes to feel the music but keep his mind busy and visualized on the core of the music.,True,False
This game bring back my memories from playing Harvest Moon: Back To Nature ten years ago. <3,True,False
"Imagine a story flipbook that you may have seen as a kid told was turn into a digital interactive form. And that the story told was a dark, macarbe one.  2017 was ones of the strongest years in gaming, and even among the list of amazing games, this is among the top ones. The ways with which interactions was used to tale the stories of the Edith Family was brilliant, and the tale themselves were really good. There's one sequence that can easily go down in one of the best moments in digital storytelling, but I won't spoil it. I'll get anything that Annapurna publishes. They are among the top tier publishers.",True,False
"It was a very nice journey but so short , I hope i can find a similar game like Far lone sails <3",True,False
the best game in the world,True,False
"I had great time playing this game. Shooting enemies was fun, story was interesting to follow and the game looks beautiful! If I had to find cons, there was some little bugs, e.g Elizabeth throwing salt/ammo/coin through wall. Also, I got stuck few times, whenever it was Elizabeth blocking the door and not moving, or me doing parkour-thingies and somehow managing to get stuck in a small gap, it was a bit annoying to load from the last checkpoint.  But those weren't game breaking at all, so it's all good if a great game has a small bugs like that!  Awesome game, would  totally recommend at least trying it if you like FPS games with great graphics and story.",True,False
The Witcher - ok The Witcher 2 - epic,True,False
A very good game.,True,False
"i love the game, i got six hours in by now, i discovered ""gentle mans"" mode, this makes it amazingly extra difficult i love it",True,False
its nice,True,False
10/10 got abducted by aliens and smoked weed,True,False
"Game is amazing worth buying it if you love space battles, colonizing planets and micromanaging your economy this is your game Game early is slow but once you got your economy running you gonna move faster and expand how you like where you like(depending on your army too)",True,False
"If you enjoy JRPGs this is the perfect choice: the mixture between Job System Level and Characters Level is really huge and the Story (as in most of the titles of this Saga) is gorgeous. Nobuo Uematsu, as always, showed majestically his talent as composer.",True,False
GTA V Is a very good game but sometimes Moderators will always try to kill you With the mods.But for the most part GTA V Is a very good game.(:,True,False
I deleted it to make extra space on my old comeputer (it also was a terrible laptop so it wouldn't run wll) but this game and especially the sequal are AMAZING this game is deffinatly going down in gaming history as an all around great game.,True,False
This game was once good but the developers have ♥♥♥♥♥♥ it bad,True,False
"GG, walking simulator with an interesting story",True,False
2018 crush <3,True,False
"One of my top 5 most played games in my steam library! The sounds, the scenery, the players and the different maps make this game really well-made. There are many opportunities that you can make so even after long hours it won't be boring unlike other games, because you can play as Squad Lead, Infantry, Tank operator, Scout, Pilot or simply Support (logistics and/or super FOB-ing with TOWs and mortars). Not to mention the multiple factions with their own weapons, vehicles, tools and buildings respectively. If you wanted to compare with other games, I would say a really realistic game as Escape from Tarkov (no hitmarks), open-world with vehicles as Arma 3, respawn system and customization as in Red Orchestra and Rising Storm series, but if you just want to kill everyone because you are used to the fast paced CoD series, then this game is not for you: a map can take up to 1,5 hours! Regular updates with the feedback of players are always released by the helpful devs! And one more thing: the game isn't dead, the servers are mostly full. So don't worry, it's not Battalion 1944.",True,True
This is not a game. This is art. 10/10,True,False
