#en_reviews,upvoted,early_access
"There's too much positive reviews to not call it an organized campaign. The game has been made in Unity and I bet most of the models have been lifted from the unity asset store. Game can be completed in less than 15 minutes. It has enemies that are blind and won't hit you unless you choose to not kill them and just run past them. I was hit twice in my 2 minutes long pacifist sprint to the end boss. This game has only one level and it's extremely short, it has intersection of two streets in the middle of a city and a short, pointless train road that leads to the city from the house of a protagonist. There are no health pickups, no ammo pickups, no weapon pickups, you start the game with AK47 with 700 bullets and a rocket launcher with 100 rockets and it will suffice till the end. Main boss has a shotgun and he actually can aim, but you can easily outrun him or just jump on the building. Somewhere in the 2/3rd of his lifebar you'll race his friend (that will crash on the crossroads) and after that you'll fight him again. The End. The couple of screenshots in the game present all variety that can be seen in the game, so there's really nothing to see. One ladder that can be seen isn't functional, also most of the level geometry is simplified, meaning you won't be able to enter most building. Despite that you can still get out of bounds and run to the edge of the map, or bug the game out.  I am aware that this is a meme game but even meme games should have some content. Check VCB Why CIty for comparison, also made in unity by russian devs but with at least some content. This is just lousy. I'm pretty sure it's a student's project and the dev thought that a passing grade is just enough for commercial release.",False,False
"One of the most boring quiz games I've ever played. Just a bunch of pop-up questions with true/false answers, one after the other, and... nothing more. Waste of time, I don't recommend it.",False,False
Good idea Poor execution. Pros: - Graphics are somewhat beautiful and realistic - Open world - Flower picking ups your strength. Cons: - Linear story. - 99% fetch quests. - Not much replay value. - Poor balancing regarding progress. - A lot of minor bugs - Some major bugs that break your save/game. - Nothing to do other than quests - No factions - Anything you do does not affect story or the world at all. - Sequel will be released as a seperate game. - Frustrating combat mechanics,False,False
"It is indeed a game that many people call a nice game to spend time with. But after one place, it does not really take time, it starts eating. When I felt this, I understood it as a game that was not worth its price. If you really like to try very different games, give this game a lot of money. Other than that, you get really discounted. Or do not take it.",False,False
"Crashes within 30 seconds after loading the chapter. Sound keeps on playing. The system exceeds the system requirements by far. Drivers are up to date, nothing is overclocked, system is totally stable. Really bad PC port. Can't recommend until fixed.",False,False
"it more like ""Infestation: The HackZ""",False,False
i bought a 3080 and a i9 10850k and i cant even play this game on a samsung evo at 60 fps ultra i want to cry now and this game has been in alpha for 15 years i do cry ever-yday,False,True
Didn't play much bad game.,False,False
"very repetitive after a couple of hours, the combat is cool nonetheless",False,False
"August 15,2016 5:48 am First and last network activity initiated with Italy 62.152.111.43 Ducati With this first connection I got  First victory   Unlocked Aug 15 @ 7:18am Welcome to the 70s   Unlocked Aug 15 @ 7:18am The Aristocrat   Unlocked Aug 15 @ 6:41am Just the beginning   Unlocked Aug 15 @ 7:18am Ever since that every time I finish an event it fails to give achievements or points and can not make connection. I won't buy Milestone ever again.",False,False
"Played for 6 minutes, played too much. 플탐 6분도 너무 길다.",False,False
"My key just was revoked, I activated this game 18 Aug, 2017!!!  DO NOT BUY THIS GAME!",False,True
"If you care about who sees the games you play, FOR THE LOVE OF GOD DO NOT GET THIS GAME.. It will make you look like an absolute sad r'♥♥♥♥ lol.",False,False
Tired of the gimmicks...,False,False
Not for Win 7 users as mouse cursor mirrored. Wait till it's fixed.,False,False
"Too many aspects of different genres, none of them polished. For a 2013 game the graphic sucks. I not recommend it. Just open Winamp if you want to listen to music",False,False
"Reviewing for the Grand Prix. The game is actually dogsh**, though GRIND, GRIND, GRIND",False,False
"EDIT 2 : After the Iceborne update, Performance issues are back. I re-edited my review. Seems that Capcom achieved to create a ""regressive Update"" (yeah it's a contradiction, right?). EDIT : After the last patch, seems there are no more connection issues. So I edited my review. Big fan of Monster Hunter series, i was waiting for this PC version for a long time. Now that I have it I can say that for the most part it lived up to my expectations, they added many features that I hoped for. - Good variety of monsters to hunt: old as much as new ones (some are a dissapointment but    hey, it's my opinion). - The maps are gorgeous, and dynamic : you can use the field to your advantage. - Since the Online mode works fine, plenty of hunters to play with.   Good feature : your lobby can support up to 16 players, helps alot if you have more than 3    friends (old games were limited to 4) playing with you. - Iceborne is a good expansion, lots of new monsters to hunt (plus those yet to come) - The maps are bigger wider - The new featured tool Clutch claw is a bit too much, though it adds some flashy moves. The game at it's core is good but UNFORTUNATELY, and I think all those months of delay was alot of wait for a mere port with big performance issues:    - Alt-Tab when the game runs in the Fullscreen mode causes a crash...    - The game is even more taxing on your system than it used to be (90-99% of CPU/GPU usage, and I tried many ""fixes"") I recommended the game since 11Nov 2018, but as it is now I DON'T RECOMMEND buying it!",False,False
"This game is insanity.It was better but now its ruined,all the things you can do is loose your time because this ''GAME'' is the most stuped and buggy one.Its true....It was fun before and I had a great time BUT now I cant even loggin in my account because I cant visit the site..... I cant play it anymore....    TNX WHOEVER DID THIS",False,False
"Yea it's worth the 95% off, and not much more. Actually got me back to the game for 2 hours. Still don't enjoy the game. i got bored. Might uninstall later.",False,False
"First of all, I do not enjoy war games or realistic settings, that's why this is my first CoD; I always hated what this series has become, but people described me CoD4 as ""the last good Call of Duty game"", so I decided to buy it. Having played several good first person shooters before, I found the campaign mediocre, extremely linear and with an inconsistent level design quality. Also, didn't really got caught in the story, but that can be absolutely my fault. Multiplayer is fun I must admit, but nothing really special in my opinion. Graphics are okay, but not glitchless, and the game crashed on me on various random occasions. I like the sound effects and soundtrack enough. I guess there's more than some people who can actually enjoy something like this, but clearly it's not a game I would reccomend.",False,False
very bad game i played it in the beginning but i stopped because skins are 2 expensive like hell... So better game is GTA5 because its like csgo but with open world. Termted 2015 - vote for president LugDit 2016,False,False
"Heck off you couple white knights still defending their immeasurable duck-up. This game is almost Bless Online all over again just 3 months later, the only thing tho is their game sucked but they worked hard. Here we can see it the other way around, their game is actually looking great , they suck though. Can retweet content creators stuff but cant just post something like ""Were working on it, updates when were going somewhere"" etc. which would already show us something. Also ""theyre stresstesting rn"".......... if i pay for something you should actually be able to play it to atleast some extent. The biggest joke of them all still is their Discordserver .... People labled as ""Devs"" are playing BF1 rn :DDDDDDDDD",False,True
♥♥♥♥ company making decent games. ♥♥♥♥♥♥♥ sucks.,False,False
"The biggest ♥♥♥♥ in the gaming scene. Do not buy it, do not play it. Thats all.",False,False
Valve suck my ♥♥♥♥ you made a nice job with the cooldown sistem next time ban me for 7 years when im not connecting because of your servers.,False,False
unable to get achievements after hours of trying to fix it. woe is me,False,False
"Artillerists is like a really bad, unbalanced version of the old boardgame Battleship, which has been re-created as a video game quite a few times and much better than this. This is a complete guessing game, at least to the extent that I have played it. You can earn money to spend in an upgrade shop (the Artillery, where you buy ""abilities""), but you have to grind out guessing games to earn the money.  Whereas this is obviously a Battleship style game (obvious even before you purchase the game), what you don't know ahead of time is how unbalanced it is. By the third mission of the main campaign, you have 2 mortars in a 6x6 grid. The mortars take up one block each, so you can only take 2 hits and then you lose. The AI has more than 6 blocks of units in a 6x6 grid, and the game gives you no idea how many the AI has at the beginning of each mission. I haven't made it past the third mission of the main campaign (as of this review) because this is just a pitiful waste of my time when I could be watching paint dry instead. The AI also has ""abilities"" to hit multiple blocks, whereas you are stuck with grinding to buy lesser abilities early in the game, and they are really expensive and underpowered, particularly when the AI has some ♥♥♥♥ that can hit like 5 blocks at once as well as at least one airstrike (which hits 2 blocks) by this third mission.  You can use radar and airstrike abilities if you have purchased them at this point, but they are very expensive. When I say expensive I mean you will grind out clicking on grids trying to win missions in order to gain money. There are side-missions in which you can gain money, but the clicking and guessing is just horribly boring. In the game Battleship it's essentially the same, except you know what you're up against (the same units as you have, and there is a little more fun to the minimal planning and some strategy involved even though it amounts to guessing). This is just a poorly thought out game. Nobody likes an unbalanced guessing-game. There are people that pop up with irritating dialog as well, which just makes it even more annoying because that makes more clicks to grind out.  Count this as an extremely negative review. HUGE thumbs down!",False,False
"TLDR: If you expect a Sanctum-styled game,look elsewhere. If you are looking for a fun defense shooter to play with friends, go ahead.  This game's art direction looks and feels amazing, but if you expect the game to require deep strategy in the tower builder phase, don't expect too much. I bought this game expecting something closer to Sanctum 2 which pushed both the tower defense and shooter parts further. This wasn't really it and was kinda disappointed but kept playing since it seemed like I had a misconcetion about the game's intents in mind. The game seem to mostly revolve around casual multiplayer game with friends, which isn't a bad thing in itself, and some good old run and gun with a few traps you can set around the map. Those traps are mostly to buy you time when you are looking elsewhere, there's no crazy combos you'd expect from a Tower Defense game. It feels much more like a pillow fort than anything else, really. If you want to play this game, the higher difficulties will require more team coordination than strategy, which can be annoying when playing solo. I didn't really find what I wanted in this game, but if you like playing any kind of player vs AI multiplayer shooter, this game is made for you. Edit: Rewrote the review as I didn't feel like it conveyed my feelings about the game the right way. This game's amazing even if isn't right up my alley.",False,False
Game with too much pay to win and ♥♥♥♥♥♥ balancing that likes to crash on you just before you win the game. Good way to waste your time though if you have nothing else to do,False,False
Has great slider bars to adjust graphics and sound options Can choose map mode to show the servers you can't connect to in a graphical way Works best with atlas twitter page so you can get updates on why you can't play it,False,True
"its a lot of fun but the game is dead at long time,devs leave the game,no more updates no more new maps no more nothing... if this game recive updates i start to play again until then no its not worth..bether play the same game in browser with full game",False,False
"Well the game looks good, but really I have not had opportunities to play it, it's buggy, I sincerely wanted to play the game and do not know how the whole game 'buggy' 'goes to the steam .. I am not criticizing the developer Also because I saw some gameplays and found a really cool story but did not have the opportunity to play it I hope the developer is reading this and do not take it personally, but the constructive criticism, and he resolves the bug by it's not just que me I'm having this problem but other people too !! To fix it (if he will pack, hopefully) I will stay with my negative review about the game ... if he pack up and hear what others have to say post another positive analysis of the game to why I .. I was crazy to play ;(",False,False
This game is very enjoyable but the thing that takes a bit of joy -for me- its the navigation.. I find it waaaay too sloww.... the only way to walk faster is by using your own powers wich ar very limited B-,False,False
Non.,False,False
i like the part when i can shoot innocent animals. everything else in this game is so ♥♥♥♥♥♥♥ ♥♥♥♥,False,False
Runs at 10 FPS.,False,False
Not an rpg anymore. Dialogue and choice and consequence are non existant. Story and characters are plain bad. Dumbed down somewhat entertaining pointless action sandbox. Please let Obsidian do fallouts from now on. They knew what they were doing with new vegas.,False,False
Doesn't feel good with a steering wheel. Might have been the settings I used but the arcade-like handling is a no go for me.,False,False
game sucks when you hit this red thing it makes this gay noise so i had to uninstall as gay=bad,False,False
psyonix is soft as ♥♥♥♥ i got a 24h online banned for saying good job n.i.g.g.a to my teammate for getting a goal and winning the game like seriously i know your players are children but complementing a team and saying a word that can be used for racism but in this context it is not and because of that i get online banned and i know in the past i should have not have been toxic but seriously i have been chat banned like 3 times and now online banned this is good reason why this game is dying,False,False
i get this game for free .unbalanced game and not worth your times,False,False
"Pros: + Good selection of rally cars, both classic and newer cars. Although I miss some classics such as the Lancia 037 and the Opel Manta 400. + Stages are interesting and challenging. Not as good as WRC 7 and Dirt Rally though, but it beats Dirt 4's autogenerated bland stages. + Physics in general are OK. The game is more sim than arcade, which is good. + Very good and varied career mode. + 'Loeb experience' mode is nice. + Cars have their official livery. You can also make your own if you want. + Interesting historical info about the cars. Cons: - Very weak sound. I think this is the worst thing about this game. - Graphics are bad. A game like Dirt 3 has actually better graphics and that game is 5 years older than this. - Can't clean the windshield, which gets annoying. I recommend the bonnet cam instead of cockpit because of this. - Cars flip too easily. Can be very annoying at times. - Inconsistent AI. Sometimes you can beat them by 20 seconds on the hardest difficulty. Next stage you might lose by 20 seconds. Although most Rally games seem to have this problem more or less. - MP is pretty much dead afaik. - No community events like Dirt Rally, Dirt 4 and Wrc 7 have. - Co-driver is sometimes way off. For example: when he says right 2, it can sometimes be a hairpin.  - Sometimes the co-driver calls come very late (even if you have it on the 'very early' setting). That's a problem in France when you're driving a fast car with weak brakes like the Lancia Delta S4 and there is no time to brake. I guess that's what the rewind future is for. :) I don't recommend paying full price for this (29.99€) considering how many problems this game has. However, I bought the special edition for about 10€ and I think it's a decent game for that price. This game is enjoyable from time to time when I get bored of other rally games such as Dirt Rally and WRC 7. In conclusion: Full price: not recommended. If you pick this up on a sale: recommended.",False,False
6 GB RAM requirement that is messed up the game doesnt run that hard to require that much RAM Please fix the requirment to play the game,False,False
"Don't install.  Don't play.  If already installed, uninstall immediately and post a review. After a couple hundred hours in the game, the devs changed the requirements for in-game items.  They moved the goal post on us without warning.  Not cool, but not the worst thing they could do, right? After over 600 hours in game, they did the worst.  They took things you've already earned in the game and want you to repurchase...   What do we do? If you're cool with this behavior, keep playing and do your thing.  If you find this behavior bad, write a review and uninstall or don't install at all.  The power is yours.",False,False
"If you already own, and have completed, the original - there was nothing that made me want to replay this version, unfortunately. The controls do not seem any more improved from the original - so the same issues from before are still here just wrapped up in slightly higher detailed textures.",False,False
Rip Brawl Literally unplayable since they added scythe and dash 0/10,False,False
"This game is a dissapointment to me. I expected more then this piece of crap. The only goods about the game is the graphics, textures , models. But dont forget about the bads there: 1. If you just started and someone spots you they instantly just run to you to kill you for nothing. 2. The community is extremely toxic like what the ♥♥♥♥? 3. The game is too difficult, and not fun because of all that. I dont really recommend this as a survival game.",False,True
The game is dead. No one ever plays it and it's wayy too slow paced and it takes like 3 hours to do anything.,False,False
"操你妈的能不能让我稳定连上线,经常打一半掉线 always offline",False,False
"Update: Devs silently abandoned the game after failing to inject lootbox cosmetics. While it's still pretty solid, I'd suggest looking for free Quake source ports instead.",False,False
Why it sucks list: - lag - cheaters - servers offline - boxes - cheaters - the graphics  - bad hitboxes - a ton of glitches - cheaters - DESYNC 5 sec,False,False
"this review is for phalax the only person i have seen team kill DONT PLAY THIS GAME if any one ells reads this(I only read bad reviews) then Definity play the game i got it 100% reduced and was like why not try it (I did read what others are saying negative and they suck for free you get soviet campaign. it was fun until that bit in red alert type games were you don’t get a base and have just a few troops to do a mission,,,,,, well I gave it 2 try’s and was like…… im to old for this and just played online as soviets.  This is not a freemium game the soviets are just as good as other nations you  have to perchas ) i ended up buying the American expansion with $$$$$ it was that good of a game the US expansion online they start with a base but have expensive upgrades to unlock the tanks so it’s the same as soviets just different men fun but and worth it This game is definitely worth real $$$$  I would pay for the game I got for free in hind sight  its like red alert but not silly and the online play is the best  im an older Australian gamer and don’t like playing online vs people (they drop me so fast)and ping makes them complain but this has no ping problems.   This is team play vs computer online and its hell fun, there is lots of tactics like i don’t go for tanks so much i work on anti tank and mortar support and back up team mates  i would say i wish this game was more like world of tanks a bit with clan wars  there is NO SOCIAL atmosphere in this its not that people are mean there is no talking.   In game its hard to see the chat box and i have not heard any mics  In chat rooms its full of people talking other languages than English and they don’t talk much at all  i bet there are clans with team speak this game would be so good for that so for any person other than phalax get this game get a mic look me up my profile is not privet we will join some team speak clan and drink beer and get smashed by computer players on expert :D",False,False
Its awful.,False,True
"I wanted to see if this was a good game, I downloaded it and everything. Once I hit the play button it wont even open T - T. I am definitely uninstalling.",False,False
"Visions of riding horseback terrorizing Indians were running through my mind, then i clicked join game.... NOT RESPONDING and seemingly it was loading 'The Easy Stuff'  Eventually after restarting my pc because the window wouldn’t not minimize, ALT F4 wouldn’t work and the task manager wouldn’t come to front, i got into a game.  No purpose to the game, ROK had purpose but this was just pointless.  Do yourself a favor and do not buy this game.",False,True
∆gay sh!t .. vac with out cheating ... this is f*cking b.sh!t,False,False
What once was a good game is not plunged with modders and ridiculous prices and absurd vehicles and weapons that makes the game no where as enjoyable as it used to be.,False,False
♥♥♥♥♥♥♥ GAME PIECE OF ♥♥♥♥ AUTO DISCONNECT BUGS NOOB GAME DONT LIKE IT,False,True
"Where to start with this game. There is so much wrong with it. From the developers to the foul community. Let me start with the community, because this is whom you're going to interact most with. It is filled with  ,   and others. I had the unfortunate experience of walking into a condo filled with watersports. The owner was a   who proceeded to inform me about how she sells marijuana in her own neighbourhood. She then told me that because she forgot to UV ray her product one time - she urinated on it instead and sold it to customers unknowingly, who reportedly liked that special produce batch. She then does this with her partner.  This isn't uncommon for this game. 99% of the houses will be littered with furry and water sports. This community is not safe. It is not functional. Most of the player base have something very much wrong with them - from being suicidal to just down right weird. The developers don't care about it either. I informed them about some condo that had hints of child porn in it. They chat banned me instead of looking into it. Way to silence whistle blowers. My friend also got channed banned but for entirely different circumstances. Another friend of mine doesn't play this game anymore because the community is so, so weird.  Moving on to the developers, ah the developers. Cut from the same cloth as the player base.  They don't know what they are doing with the game. It's poorly made and even though they have a road map, it makes it ten fold worse that they can't stick to it as an early access game. So, in conclusion. If you're a furry, or you are into animal watersports on humans and love to see child porn littered around condos - then this is the game for you. BTW, if you are wondering why I got this game? I purchased it for the golf mini game. I found out about the other stuff when I visited the public lobbies and condos.",False,True
"I do not recomend this game. Every time i start a match i get near the end and it just signs me out and exits the  game, once i got 25 kills and it just exited the game and when it does that you dont get any rewards. Not Recomende",False,False
"Used to be great coop game, fun to be played with friends and its requires teamwork which makes the game so fun but NOW the developers are getting greedy by releasing overpriced and constant DLCs which they called it ""Hype Train"" while people actually criticizing them for being greedy. Just get this game when GOTY version on discount (and expect moar DLCs) I wouldn't give this game a thumbs down if they let us buy Season Pass",False,False
game seems pretty dead,False,False
I find the interface to be messy and they have a voting system that feels very forced. There's no need to vote when you should just kill the monster.,False,False
