#en_reviews,upvoted,early_access
"Now... I guess the best thing I can say about Prospekt is that its concept is well executed, and that there is at least a portion of the game that really ties in with the Half-Life 2 spirit... BUUUUUUUUUUUUUUUUUUUUUT 1) The game is too hard, even on normal. I couldn't count how many times I double-barrel shot a combine in the head TWICE before he had to die... 2) The level design, is ludicrous. You are being pitched against waves of combine after every door and elevator with NO WAY TO HIDE. 3) The voice-overs, although high in quality, sound too amateur to be convincing and disconnect the original Half-Life spirit from Prospekt. 4) Buttons, buttons and buttons. 5) The story, which each time triggers an incredibly annoying effect as you recall flashbacks from the past, is underdeveloped, but it's not the main part of the game as it focusses heavily on combat, just don't expect a satisfying tale that will move or motivate you in any significant way. The ending is mediocre and almost a carbon copy of the beginning if you look at it from a distance. I have to say I really welcome and applaud the additional combine machinery design that can be found across the levels, and the smart use of the cubemaps. My favorite level was the teleport level, even though it just repeated the same button idea all over again. Soundtrack is excellent, one of the closest things that could absolutely fit in an original Half-Life game, as much as the actual sound design. I would rate this game a 6/10. Just don't forget that after all, this was made by one person, it's just sad that that really shows in the game.",False,False
"I played a lot of HOGs already and not only games from Artifex Mundy but other studios as well. This one is by far the worst I played so far. The graphics is crappy but mainly dialogues have to be listened / skipped one by one as there's no continuality in discussion. The plot isn't bad but so lame ""visit psychiatrist - you need books to impress her (HOG) - enter her office - you need to look for cards (HOG) - she says 2 sentences - I need tea (HOG) - she say one sentence - I need pills (minigame) - she say two sentences - I need positive energy (HOG)"" and so on.. While on the map, there's no change of cursor or indication what is interactive feature and what's not so you just click madly around the screen when you miss certain object and in the end game even glitched in the beginning not letting me leave / interact with anything prompting me to game reset. I finished it for achievements but I did NOT have fun. Strongly recommend looking for a different HOG game.",False,False
"Another battle royale, if that's your thing then you'll like it and if you have friends to play with i'm sure there is some fun to be had too. I just personally found it too difficult and unrewarding, I refunded the game, i'm not confident that in the 2+ hours i'll suddenly start to have fun.",False,False
"So Valves VAC ban system and overview system is absolute trash, I got banned on my main account ( this account) because of supposed ""wall hacking"" just because I like to spray a lot when I drop smokes and sometimes I get kills, and I had over 110 hours in the game with 50 competitive wins on my main and I was part of a group that had proof that I didn't wall, we even streamed on twitch sometimes, but no, I got VAC Banned. Next thing you know I'm playing my second competitive game on this account with PRIME, and the people I just played against we're Aim botting, Wall hacks, and trigger bot and they we're all prime.  This game's VAC is a joke and Valve needs to get that pole and shove it out of their asses and do the right thing, they need to improve their VAC system, their Overview system and so much more. What a shame, this game was better before it went free. Now look at it, full of hackers..... Gameplay: 4/10 Visuals:7/10 Sounds: 6/10 Matchmaking: 0/10 VAC: -100/10 (broken as ♥♥♥♥) Valve: -999/10 (need to get that gold stick out of their ♥♥♥ and make CS:GO a paid game again)",False,False
couldnt even start the game because it crashes everytime i try to play. REFUNDED.,False,False
I don't even play this game anymore but ♥♥♥♥ R*/Take two if they remove modding from this game. It sets a bad precedent and we can not as a community allow it to happen without consequence.,False,False
"After 17 hours i gave up.. From limited bank space to almost everything weighing something and it even cost you AP to jump. If you see this review save yourself some money buy fallout 4, add tones of mods and have a much better time than what this game has to offer. Also buy Fallout New Vegas It has out dated graphics but hands down the best fallout game !!!!! F this game in the A***",False,False
biggerest aids of them all,False,False
"As much as I loved this game, I cannot recommend it as it is right now. The amount of glitches and bugs make this game almost unplayable. I could go on with specific examples such as many side quests, that are simply most of time frozen and you are stuck at the objective, which exists on the map but not in the world for some reason, like the bees and honey quest, which was mentioned on several forums since 2017 and nobody bothered to fix it. Motigene Gives You Wings freezes the character and you are unable to talk to him to complete the quest. Superb Meat Boy quest breaks through the last cutscene and therefore you are unable to complete it. You can even accidently fail a quest as you get attacked by people or characters are stuck inside the walls. Not mentioning the worst and most frustrating glitch I experienced half way through the first Act - save option being disabled. No matter what I did, restarting the game, killing myself/restarting the level, taking and completing quests, moving from one district to another, entering buildings etc the game did NOT allow me to manually save the progress. It did fortunatelly autosaved after completing the quests, but when I tried to exit the game, the message popped up saying that the game cannot be saved because the character is busy or something like that. Overall performance issues, unstable FPS, many technical problems, blurred textures, invisible obstacles, frozen animations, broken quests and game breaking issues. Sometimes the cutscene ends but the game doesn't detect it and you are stuck in the letterbox view with and not being able to move. It's a real shame, because the game has a big potential, great creepy atmosphere and beautiful detailed sceneries. If you like Fallout, Bioshock, Bendy and Ink Machine sort of games, you would love this game for sure! British themes and voice actings are amazing, and it's one of the reasons I kept playing this game. But let's face it, this is unaccaptable to sell broken and unfinished game for THAT price, this is just an insult to all gamers",False,False
its ♥♥♥♥,False,False
"First Review: Game does not support racing wheels, shifters or handbrakes. Also crashes frequently which causes game to be unplayable. The rotorys also have camshafts. Second Review: After being unable to return the game I was forced to find a way to make it playable. This was done by limiting my gpu to 40fps and putting low settings on everything. My specs are i5-9600k 16gb ram and rx480. The game still crashes just not as frequently. Overall if you can get the game to be playable it can be pretty fun with a controller, does get a bit  grindy with having to farm money and rep.",False,False
I played this game during the open beta and it was nice because there weren't spammers and now there a f$#*$^ that spam like mother@&$#@.,False,False
"After using twitter, server report tool and funcoms email, they still wont fix the issue of servers going down. Trying to contact them is a waste of time. They just use the server report tool to make it feel like they bother, but trust me, they don't.",False,False
"My reason for this statement is simply that the full price, even though it's only slightly under 3£, isn't justifiable for the content (or lack there of)   is providing. It is simplistic move right, move left, dodge objects, shoot zombies, save some civilians, and it is presented in most boring way. It lacks any interesting parts. Design of levels feels childish, in a way even kids would be bored to look at it (and play it). Game ""mechanics"" were putting me into sleep. Upgrades weren't exciting to grind for - but certainly needed for boss battles. Boss Battles are harder, but not in pleasant way; I felt it was mostly luck dependent what pick ups you have along the way, and how the level is generated. I certainly don't mind when games choose casual approach to their games, but this experience was even too far below that line.  is something you would probably encounter on the mobile app stores, or somewhere on the internet sites that provide games you can play for free. Try your luck, you might find it there and realise you can use your money on Steam store in more meaningful way.",False,False
The last update completely ruined XV2 modding and customization for PC players. GG Bandai Namco,False,False
Do not get this game unless your computer runs like god on steroids. You need the best computer to play this game.,False,True
"You can literally eat dinner while playing this game. I tried, it works.  - Boring and repetitive QTE moments. You don't have to press the buttons at all, Batman throws a punch even if you miss the QTE sequence. (Try this one if you want, only one in ten QTEs are essential, the rest are garbage.) - Useless dialogue options. ""Yes, I'm not sure but yes, ♥♥♥♥ that but yes"" Or you can be silent for the whole game, pretty sure that's not going to change anything. - Awful character depictions -I'm not even a hardcore DC fan and I cringed so hard. For example, Selina is only in the game so Batman can have a love interest.  - Weak storyline. It's just a copy paste of Arkham Knight with small changes and those changes don't even make sense.  Here comes the rant for that:  - I thought the catacombs were supposed to be under the prison and not the asylum? But ♥♥♥♥ the logic, right? Also this game’s optimization sucks, so be aware.",False,False
"Has a FPS lock and you can't remove it. Dislike playing 76 fps on a 144hz monitor. Don't know why this isn't a feature to allow us to modify the FPS cap. And no, V-Sync is not on.",False,False
"Pay To Win... but hey it's better than Ironsight, Warface, and Hired Ops! It has better netcode than those 3 ♥♥♥♥ games and is just more playable in generalm as long as you don't join a match with veterans who have ""Prestige"" guns.",False,False
This is a literal scam do not buy!!! if you want to subscribe do it through the actual website. as of right now buying it through steam will only get your money taken from you.,False,False
you guys are making stupid updates that destroy this game,False,True
story ends abruptly a few minutes in,False,False
This game is fun i used to play monopoly a lot with my family when i was a kid  But. I have a lot of things to say why i wouldnt spent my time on this game 1.The game is rigged - yea kinda its not rigged more like patterns but who knows the patterns has an advantage -1 point for that  2.Its pay to win - I wasnt suprised about that thats a free to play game but for example someone has a 7 on my plot so he would need to pay 300K so he wouldnt land on my plot and land on other plot becuase he spent that 3 gold - thats a good way to make the game less pay 2 win but still i dont mock points of this if it was a paid game the game was a really bad game  3.The winner is chosen before the game starts - i felt i got destroyed always landed at tax and my opponent plot and lost after 2 mins -2 points So if the game was totally random i would play that game everyday  but i rather gather friends and play real monopoly,False,False
"Pretty much used to be a fun lil game to kill time, now is complete and utter ♥♥♥♥. good job ubisoft, you never stop amazing me with your bs",False,False
"Small maps, poorly designed maps, poor graphics for a 2017 game, short time to kill, unbalanced weapons, feels like a COD from a decade ago that's just reskinned. Nothing special here, it's okay to skip this one.  I like the hitmarker sounds though",False,False
Hollow empty game - time consuming with no real content.,False,False
"If you like achievements, good news for you, only 6 (frustratingly dumb) levels, you can get all the achievements in as little as a few minutes!  The developer clearly does not care about video games, he just wants to make a quick buck.   These are assets found off of the Unity store, by two different makers, and the game is in Unity, what more do I need to say about this? The game consists of 3 sounds and one music track, that's all there is, so if you came for spectacular music, leave. And did I mention that they're using royalty free music and sounds? Amazingly, the game takes only a few minutes to complete (*shocker*), so if you want to obtain all 4999 (notice I didn't say 5000) achievements, it'll only take you a few minutes to do so. He's not trying to hide the fact that it's barebones or an asset flip, so sad to see gaming consisting of titles like this. What's even more sad is that he actually hard-advertises one of his game, you stare at the poster of his game and you win. That's it. Also, about the last achievement, you can't get it. Completed the game 3 times (while I was waiting for the time limit to go) and you straight up just can't get it.",False,False
"dev = narco games with ♥♥♥♥ logo.. unity replica game copyrighted music?? ( i think , he is not so smart to remix ) you can go in walls, and then fall  some ♥♥♥♥♥♥ russians voices  ____ why russians cries about bad reputation in  the world, if you demonstrate how ♥♥♥♥♥♥ you are through games ,,, and i mean its not the only games like this,,, tired to review ♥♥♥♥ -.- what a waste of time...",False,False
"Mediocre platform, it's not enough having cute characters and pixel art, the game design is uninspired and empty, the game play is not much funny and quite frustrating and the flying mechanic is lazily implemented. Overrated. 4/10",False,False
bough a 2 year pass for the game dont get shadowkeep GG bungie blame activision to be money hungry they aint better,False,False
"and   is super Important to Me as Cope, get Resistence or Conquer, but Right now, I use the   aka: Not Working, Not Pleased, etc...",False,False
:( boring,False,False
This game started with a blast! However they ♥♥♥♥♥♥ up selling it to epic.... All servers is offline i can't search due to epic games ♥♥♥♥♥♥ service being offline yaaaay! Consider prioritizing your old players we ♥♥♥♥♥♥♥ paid for this piece of junk!,False,False
"I really like this game, but the absence of a save option makes playing this game to tedious.  Especially when without warning the advantage is give to the AI.  I know you ""hardcore"" gamers will probablyy say, ""If you can't stand the heat, get out of the kitchen"".  But I haven't seen or heard a good reason for not having a save option for the casual gamer.  Having to start the game over everytime my team gets taken out has become an annoyance that is making me feel I made a mistake purchasing this game.  So I'm going to recommend this game until there's some kind of save option.  I'm sure I won't be missed.",False,True
"You know what I was just thinking about a couple of days before I received this game in Curator Connect? ""I haven't heard from BMC Studios in a while... maybe the developer finally got the hint that I actually really hate his 'games'. Maybe he finally realized that I don't like him as a person through what he's portrayed with his 'games'. Thank god I haven't had to suffer through that trash in a long time"". Aaaaaaaaaand here we are. True story. It's like he read my mind and decided he hadn't sent me any spam keys in a while. I think what he does to me is part of the meme culture he embraces so much. I think he actually likes hearing from me. In case you haven't noticed, I loathe BMC Studios and we have a history that dates pretty far back... to their first release actually, when there actually was a ""their"" and not just a ""he"". So yeah, after his friends left the ""company"" this guy dropped out of college to pursue making this kind of garbage. The kind of elementary school trash that makes fun of people, but he tries to cover it up by acting like it's an ""accurate portrayal"" or some crap. If you need an idea, look at Coughing Simulator 2020. Gotta live that dank meme culture amirite. So, Not Well, it's supposed to be an interactive short film depicting someone who is severely depressed. Like everything else BMC Studios does, it's badly done in both context and execution. It's 20 minutes long, and you get to watch a guy sit at his computer and pathetically attempt to tear up his desk, chair, and phone without actually succeeding, then you get to watch him shower, then you get to watch him shave. Somewhere in there he pees and finds a hidden present. That's it. That is literally all this is, with a total of 3 interactions that let you ""keep your depression inside"" or ""express it"". Oh, and these options aren't even coded correctly... at least one of the ""express it"" scenes takes you to the ""keep it in"" scene. You had to code 3 things BMC Studios, three things. Let's move on to the film portion. In high school, I was taught about how long scenes were supposed to last, the rule of thirds, good transitional sequences, use of angles, etc. Either BMC Studios never took a film course in his life, or he just doesn't care. Seeing as you could teach yourself most of the aforementioned with some YouTube tutorials these days, I'm going to go with he just doesn't care to make anything that has any semblance of quality or value. With the exception of looking at him laying down in the tub all of the angles are straight on, and there are no transitions. There's nothing but stagnant 5+ minute long shots constantly. So unless you like to watch a guy shower, shave, pee, and sit at his computer then you're not going to have anything that even remotely resembles a good time here. It should also be mentioned that there's incontinuity regarding the tablet that's received as a gift later on. It's on the desk at the start of the ""game"". And the worst part of it all? This inaccurate depiction of depression that's only going to further the stigma that mental illness is only for crazy people and that depression always leads to self-harm. Not sure what he was going for here, the Curator Connect offer came with a note that mentioned something about how he felt when he was 15 and his dad died and he went through a short depression afterwards. However, as someone who has experienced extreme depression for most of their life, I can't say I've ever stared in the mirror and twitched around like a lunatic. Nor have I ravenously tore at my skin, and I especially didn't creepily kiss it after the fact. I've destroyed things in fits of depression-fueled rage, but we already went over how that wasn't executed properly. I mean, you could've at least gotten up and straight up destroyed something, but that would've required effort and energy. Everyone expresses their grief and depression differently, but overall Not Well doesn't depict any part of depression accurately; not its physical properties, its mental state, or even mental manifestations. It simply endorses the stigmas around depression, and that's why I think this is yet another meme culture poop smear on the Steam catalogue. Look man. I didn't like Kimulator, and I hate Not Well. I am a horror curator, and your ""games"" do not fit my demographic. You might find more people who actually like your work if you spend time sending your keys to appropriate curators. I've gone through this gradual progression of absolute scorn when it comes to BMC Studios, and it's at the point now where the next review will be the absolute bare minimum and a downvote. Go get an education for coding and film if this is what you want to do with your life, you will find it to be a benefit. At the very least, watch some tips or guides on how to make your content at least somewhat engaging. If you meant this release to be sincere, you need to work on your sincerity. The Horror Network   |   Click for Gore",False,False
it used to be a really fun game... until they made the stupid decision of making it free... now its just full of cheaters and offensive kids... and the report system doesnt work 99% of the time as well and vac is the worst anti cheat system ive ever seen... maybe instead of making new cases and giving us more weapons... maybe u should focus on updating your vac-system,False,False
"pros : anime grill showing some fanservice cons : difficulty spikes, too grindy, but more importantly battle animation seems too flat (at least make its very unique when they do link attack)",False,False
An issue with your computer is blocking the VAC system. You cannot play on secure servers.  FIX VAC system pls....,False,False
How to remove all the fun of the game in one update ✔,False,False
Hiding mods behind a paywall. Valve have gone to far.,False,False
"Not too bad for an indie game, definantly no AAA title but it has cool graphics and cool guns. It also has a lot of flaws, the biggest being the storyline cause it just doesn't exist its like it has one but doesnt cause it has no meaning and doesn't explain what the hell is going on it only just continues like waching a movie after its already started, it feels horrible. The storyline was the biggest let down for me. The controls need some work as they are far from sharp along with many other things but if your not bothered by those things then its not all that bad. I dont recommend this title because it has no story nor meaning.",False,False
"Game has potential and I'll still play it since the game is fun, and the mechanics of the game are already fantastic compared to other games, but with the metric ton of cash they have, it needs to go into fixing the game before content. Server has lag issues and minimum requirements isn't quite as accurate. Microtransactions are unnecessary due to the sheer amount of sales that this game has, but are fine anyway as long as they do not affect gameplay. The cosmetics found in the crates aren't exactly the greatest looking, and you won't spend much time looking at them anyway since you'll be doing 360s attempting to scan the area. The RNG element is a little too strong. *65% of games you will have full level 1 for the first 10 minutes of the game with sparse meds and a red dot on an m16. 5% of games you have an 8x on a kar98k + full attachments + suppressor on SCAR-L or M416 with level 2/3 and too many meds to carry. Other times you have the inbetween. This is even worse in squad gameplay. Final Verdict: Save your money and watch how things play out. The game is currently fun, but can be frustrating if you have a less-than-average connection or computer, and even with neither may still have issues.",False,True
"pubg sucks, radical heights is better. We want content, improvements, dab animation, maps, not skins. 2/10",False,True
"This is not worth $59.99 USD, Developer Greed at its finest.",False,False
"Recommend or not . . . Recommend or not . . . Hmm . . .  Even as I type my review, I'm not entirely sure how I feel about this game.  Did I enjoy playing it? Yes. Well, mostly.  Perhaps the tried-and-true Pro's and Con's list is the way to go.  Then we'll see where we land. So first, the positives: The art is pretty.  The backgrounds are vibrant and colorful.  The sprites themselves are beautiful, and the women are certainly attractive.  CGs are plentiful - especially given the length of the game.  There's obvious care and effort put into the artwork, but is that really enough? If you like Yuri, that's basically the whole plot.  Pumpkin is in love with her boss and wants to sleep with her.  That's essentially it.  I mean, there are some minor details in how we get to that point, but let's be honest; once you realize that's the objective, that's all most of us (guys) will care about.  Let's make it happen! On the negative, the story is insanely short. I was able to complete all the achievements in a little over an hour.  I'm a fast reader, but even still.  Many of them are for random choices in the middle of the game, so in essence there are actually only 4, or perhaps 5, endings. And one of those can be reached in 5-10 minutes. The translation is . . . wonky.  It's certainly not the worst I've ever played/read, but the grammar, verb tense, etc. is all over the place.  Now, I've had games with horrible english be almost a positive for me (check out my review for  ). But this is in that gray area.  It's bad enough that it's distracting to me, but not so far off that it's adorable.  If you're reading this VN in Russian, this obviously won't apply to you. In the end, I feel as though the playtime and general blandness of the story are enough to have me tell you to hold off on this one.  At $4, I'm not sure it's worth the money.  In a bundle, on a 75% sale, or received as a gift? Absolutely worth a playthrough.  But just the once when you have an hour or so to kill.  And you want to see green and purple nakedness. P.S. In the game, hit TAB then type the word 'code' to unlock the nudity options.  It's not exactly vital or game changing, but I mean . . . boobs . . . so . . . yeah. Might as well look at them.",False,False
